{
  "_comment": "Bren, the demo Fighter for the human seat (Milestone 4 spec §3, decision D2): a Human Soldier with Defense, Chain Mail and a Shield, AC 19 and 20 Hit Points. One Potion of Healing, as each pregen carries (spec §3).",
  "id": "fighter_l2",
  "name": "Bren",
  "species": "nat20_core::species.human",
  "background": "nat20_core::background.soldier",
  "class": "nat20_core::class.fighter",
  "level": 2,
  "ability_scores": {
    "_comment": "The SRD 5.2.1 standard array as the Fighter assigns it; the Soldier adds 2 and 1.",
    "strength": 15,
    "dexterity": 14,
    "constitution": 13,
    "intelligence": 8,
    "wisdom": 10,
    "charisma": 12,
    "plus_2": "strength",
    "plus_1": "constitution"
  },
  "choices": [
    {
      "_comment": "Versatile: the Soldier already grants Savage Attacker.",
      "prompt_id": "choice.human.versatile",
      "picks": ["nat20_core::feat.skilled"]
    },
    {
      "prompt_id": "choice.fighting_style",
      "picks": ["nat20_core::feat.fighting_style.defense"]
    }
  ],
  "skills": ["acrobatics", "perception"],
  "skill_choices": [
    {
      "_comment": "Skillful.",
      "source": "nat20_core::species.human",
      "skills": ["insight"]
    },
    {
      "source": "nat20_core::feat.skilled",
      "skills": ["medicine", "persuasion", "survival"]
    }
  ],
  "equipment": [
    { "item": "nat20_core::item.chainmail", "quantity": 1, "equip": "armor" },
    { "item": "nat20_core::item.longsword", "quantity": 1, "equip": "melee_main_hand" },
    { "item": "nat20_core::item.shield", "quantity": 1, "equip": "melee_off_hand" },
    { "item": "nat20_core::item.potion_of_healing", "quantity": 1 }
  ],
  "money": "54 GP"
}
